{
  "generated_at": "2026-09-09T16:02:25.831403+08:00",
  "hub_root": "C:\\Users\\Fan-SJSS\\.trae-cn\\worktrees\\20260817-Fan-Agent-Momory\\feat-implement-plan-ZilBmv\\AgentMemoryHub",
  "health": {
    "overall": 100.0,
    "panels_ok": 6,
    "panels_total": 6
  },
  "platforms": {
    "summary": {
      "green": 5
    },
    "platforms": {
      "hermes": {
        "type": "mcp",
        "status": "GREEN"
      },
      "trae": {
        "type": "mcp",
        "status": "GREEN"
      },
      "code": {
        "type": "mcp",
        "status": "RED"
      },
      "workbuddy": {
        "type": "mcp",
        "status": "GREEN"
      },
      "dsh": {
        "type": "file",
        "status": "GREEN"
      }
    },
    "raw_status": "OK"
  },
  "flywheel": {
    "skill_health": {
      "ok": true,
      "stdout": "avg: 95.0 low_health: 0",
      "stderr": ""
    },
    "llm_route": {
      "ok": true,
      "stdout": "llm_route hits: []",
      "stderr": ""
    },
    "stale_detect": {
      "ok": true,
      "stdout": "Stale 卡片：0 张\nStale 技能：0 个",
      "stderr": ""
    },
    "knowledge_gap": {
      "ok": true,
      "stdout": "gap: 0/0 (0.0%)",
      "stderr": ""
    },
    "skill_candidate": {
      "ok": true,
      "stdout": "生成 54 张建议卡：\n  - cards\\skill-candidates\\activedirs-five-type-discipline.md\n  - cards\\skill-candidates\\agent-memory-hub-mcp.md\n  - cards\\skill-candidates\\autocad-com-automation-deadlock.md\n  - cards\\ski",
      "stderr": ""
    },
    "freshness": {
      "ok": true,
      "stdout": "Stale 卡片：0 张\nStale 技能：0 个",
      "stderr": ""
    }
  },
  "knowledge_gap": {
    "total": 0,
    "miss": 0,
    "miss_rate": 0.0,
    "top_misses": []
  },
  "todos": {
    "projects": [
      {
        "name": "cad-plugin-management-platform",
        "title": "---"
      },
      {
        "name": "cad2020-pdf-merge",
        "title": "---"
      },
      {
        "name": "github-autopush",
        "title": "---"
      },
      {
        "name": "hermes-fan-debug-v1",
        "title": "---"
      },
      {
        "name": "improve-ingest-dedup-threshold",
        "title": "---"
      },
      {
        "name": "pluginhub-current-state",
        "title": "---"
      },
      {
        "name": "project-threeRowRein-baseline-v51-snapshot",
        "title": "﻿---"
      },
      {
        "name": "t1-plan-three-blueprints",
        "title": "---"
      },
      {
        "name": "T19-cron-long-term-optimization",
        "title": "---"
      },
      {
        "name": "T21-5platform-后续优化-待办",
        "title": "---"
      }
    ],
    "pending_rules": 0
  },
  "alerts": {
    "critical": [
      "code"
    ],
    "announcements": [
      {
        "ts": 1788825228,
        "platform": "hermes",
        "action": "ingest_done",
        "payload": {
          "moved": [
            "test.md"
          ],
          "commit": "abc123"
        },
        "audit_id": "20260907T235348Z-ff4fceb6"
      }
    ]
  }
}